{
  "id": "ruleset-work-report",
  "graph_id": "graph-work-report",
  "graph_version": "v0.1.0",
  "status": "draft",
  "default_effect": "deny",
  "rules": [
    {
      "id": "rule-worker-query",
      "effect": "allow",
      "subjects": ["role:worker", "role:supervisor", "role:admin"],
      "actions": ["QUERY_WO", "QUERY_REPORT_HISTORY"],
      "conditions": [],
      "priority": 10
    },
    {
      "id": "rule-worker-report",
      "effect": "allow",
      "subjects": ["role:worker"],
      "actions": ["WORK_REPORT"],
      "conditions": [{ "field": "record.confirmed", "op": "eq", "value": true }],
      "priority": 20
    },
    {
      "id": "rule-supervisor-revert",
      "effect": "allow",
      "subjects": ["role:supervisor", "role:admin"],
      "actions": ["WORK_REPORT_REVERT"],
      "conditions": [{ "field": "record.age_hours", "op": "lte", "value": 24 }],
      "priority": 30
    }
  ],
  "metadata": {
    "created_at": "2026-06-16T00:00:00Z",
    "updated_at": "2026-06-16T00:00:00Z",
    "frozen_at": null,
    "frozen_by": null
  }
}
